{
  "schema": 1,
  "project": "culinary",
  "reviewed_at": "2026-10-17T15:53:53.370074+00:00",
  "snapshot": {
    "source_hashes": {
      ".githooks/docs-pre-commit": "842e2f7b7f9eeeb4bd901a1e9b2260040b2e6904ef507dc4551eec8774402256",
      ".github/workflows/deploy-pages.yml": "4f23b9e152131232d5dba192c8be3844dff25d19a87707e80317ed5e6ed783de",
      ".gitignore": "970886ad31eb0cd9751892774b2cd8ade944baae6e035b0bdd90d6e484535fa5",
      ".nojekyll": "e3b0c44298fc1c149afbf4c8996fb92427ae41e4649b934ca495991b7852b855",
      "AGENTS.md": "75ee3102a80c54b6dec5833767f8296451b409489a4dc7325cecaf762c6f3c25",
      "ASSET-SOURCES.json": "4f25c63b708332ddfb97d1ca5db4bf91ca19ab391b8703e3080856d1ff5711e0",
      "CLAUDE.md": "75ee3102a80c54b6dec5833767f8296451b409489a4dc7325cecaf762c6f3c25",
      "CLIENT-QUESTIONS.md": "22b8da38bdf2db361059875d522f39b3931d2671757c13038dbbe22193276142",
      "CNAME": "17c88105d7046ae1b1006fc02045690d4066bf2758e906d2c0e5e63b2986e5b6",
      "CONTEXT.md": "26434ecc4fdfdb60598e75e6cabda4582ab07b3e8d7eba64a395dd5d7c06f4f9",
      "DESIGN.md": "94350dfbe5882dde67e79c559da29f6f46f3aef038c7d3c12c8ff778999b1bbb",
      "LAUNCH.md": "43559b1882756eb309dbeae5b6a27002a57ffe226e476a550fc8f01faa628650",
      "README.md": "333c08ddb62bb04c4ae2c24cea05266cb214855013b476f9713d40291ac93a9d",
      "build-blog.py": "7632102b6d41893f3d2a531482d53802151bb67746426f954f1a78f99225cad7",
      "build-menus.py": "53b495bbcafaca1258d5e1209b7ca0ccb3f476e0c22f3c8e496e332f1737374c",
      "content/blog/choosing-a-private-dinner-menu-for-different-preferences.html": "773735c7d39a630eb037f100c0c96483922051073a73129c47685b52ef8de6b6",
      "content/blog/choosing-a-private-dinner-menu-for-different-preferences.json": "acd1c09abc74c2cb9bf206286e2a4f2f25b9a11ff6d115d49c70b1ab7181d021",
      "content/blog/in-home-cooking-classes-planning-hands-on-experience.html": "836600f19229caba6005fe24e3e0ef4eb80d1f22660a69770a587f3f39f2c723",
      "content/blog/in-home-cooking-classes-planning-hands-on-experience.json": "6a5132624944cfc5b03cfaffabbee46988537d49e9538efe97b9d03307f3d9ad",
      "content/blog/planning-private-chef-dinner-south-florida-gulf-coast.html": "d9f9334a039482ef43502684e222da4325dbe2d90da19736737a0ed31c0cdb37",
      "content/blog/planning-private-chef-dinner-south-florida-gulf-coast.json": "0ec251e2d2e33b95f482475442f2a9ccf3831ecd672c50d796c6ece5a523f4c5",
      "content/blog/private-chef-dinner-or-event-catering-how-to-choose.html": "06929e0a6bc4dff54615906d7a114dc1ab7d55a983d211a75f22c3e5129b94ed",
      "content/blog/private-chef-dinner-or-event-catering-how-to-choose.json": "9a6bc9633f9ac712099051caaf48e775c497786cdb2ffc4cb7c85cee11fffd7f",
      "content/blog/what-to-discuss-before-booking-weekly-meal-preparation.html": "54b7d0c36bc743228768267f8ae1e98416af64b9a339ab48473532f8bdf32221",
      "content/blog/what-to-discuss-before-booking-weekly-meal-preparation.json": "1f29f58a9a5bd342d0e53d8a522e1c4263433ae6d7ce187b2fd69aafa5efedcb",
      "docs/CONTEXT.md": "c36b6eb39a17adff04d0a3cb5c49fc114b29a3860969774c09b6f24bdbe6c1db",
      "index.html": "5c9c6fda28c151dbcaaaa3abecfd638d1c5a8442c389086692966b498c52d20e",
      "menus.json": "5e0d365d04f3157afe9532c27318d7b6a971db1a2f7109303a3ac9a218f01ea2",
      "ops/verify-domain.sh": "f3dc7a1e53012d32e4b3972778aa67df4439dc2a443968c02080e52d32538460",
      "robots.txt": "58ea7785260af8ef8dd27ffb2225ddfb199a3faaf8d94160c0ef3638e0412c50",
      "script.js": "283479aed261d07adb7f12b7e8a48f236b45a8d3c6f2db57c6bbf764a9805389",
      "styles.css": "b36b2e398e25558f7c2aeda28f8409c49e231706ed8d47453b070808137b7d83",
      "tests/check-site.py": "4354dea660686dca9c26030fc2e1fb47ee6541e2d8dfda103e09b678f0681c49",
      "thank-you.html": "815f236eb997ea5873fa07cf562d841d041366c6d65ca89c342c281bf39b9fed"
    },
    "doc_hashes": {
      "CONTEXT.md": "da6a8aed5cc71bd392094e89b335179bc9b373ec506b70cc69e18af481b904f3",
      "architecture.md": "cb55b9ca9baf0310d3db78ffee5be31b889f40622a6dc2bad564982992e48aed",
      "architecture/inquiry-and-personal-data.md": "e835cb87ee089acdbca2a9cef112c3f614805b41eae9f8129daf7d2015c5c233",
      "architecture/source-to-public-artifact.md": "d3af628abf6781f27f0ce0180ffbaa1b1e65ce59bcb080efe7a2ebb9da46c35c",
      "collaboration.md": "7dfbb087e1bcdd6e8bf4349ed7b5996e4721d06e1cb0b6590e8cc08441d80609",
      "developer/setup-and-project-map.md": "34c3a2e1906ef8c46a4cda8a50e8df4bb357f573010cf4914713622528489cfd",
      "developer/testing-and-extension-points.md": "0f4788e7890ad5bc437ec88e3700e449585725f810762b2a4920760395ec84bf",
      "guide.md": "6303fac32b7f68907e694bd9f757ee8999553c6fcdfb8d72db698d0bc715700d",
      "how-to/change-or-retire-article-source.md": "e118915a4dc4ee291899dda24979d586c409042ba6ba9f0d9d34303451dc8d19",
      "how-to/preview-and-review-interactions.md": "e853d71f0015a676474ee65b78a4c1f22b02f569246846e9f23c54c3090e3d3b",
      "how-to/review-publication-and-domain-evidence.md": "11e792d93e3f1c1649673e865ab8f8fe0fc8cee7c5d54d9fc4310d95a890c554",
      "how-to/update-menus.md": "4534edd6597ab04167cd2ddbd8ca9c62ea14fcb456f2c9ff1c81bc30d5f992de",
      "how-to/write-and-rebuild-an-article.md": "6309c95a2c51e3e933f610d2659959525c4a258c9f6ccf5bbfe423a800498bb1",
      "index.md": "defd4bb2ca7199b86c124eaa6f8d511f28f559859a4806861a22650ba5be68e9",
      "maintenance/change-impact-and-docs-ownership.md": "9fe0ca05e66ba7af8720a077e5deb0aefc55d7ccc9ddadacb211200df70827f8",
      "operations/verification-and-troubleshooting.md": "a8eeb7cd9f9f65b239c9e676822842468ab99f39c178d19c3f1fc177fbfda645",
      "reference/article-source-and-metadata.md": "d11105eeb5aa58434793bbc7be4cdb4e43b02b9e405c1a0d4b3bb17a2719d69a",
      "reference/browser-contracts-and-form.md": "7065f66de2ebf3e25a0e671d6c435903ea67d2aa56bce8cf4e18fe2134596bba",
      "reference/dependencies-and-configuration.md": "85073a03c15b9d6757c2498cd2bdb6cfd5d672c2f27c8fa124c7f5f6336cf6ec",
      "reference/design-assets-and-crawl.md": "c2db51678ebcb0505eb580ebcc365bcc9808ef6ed8487343dcb931eb9e5b1c5d",
      "reference/generator-and-checker-cli.md": "aa22f41fd852dc2fef074459d702ae9d370f0669aedf947038921b15ca10c9a3",
      "reference/menu-source.md": "c1053a51e18c8328dbcf2f95affdc49b7b4e52fef9fdb85fd5d32d5e1cff986d",
      "sidebar.json": "5244d543bf1134629e5c1d872d9bcba0f0ba0c9fc7c4416486b88253c9177191",
      "status.md": "ce94b3ef9dfcb9fafae5ffb1f6be50c5ef8a3c10141a488387cfc1fdbca5abeb",
      "tutorials/check-the-shipped-site-offline.md": "622f0d35be9606e334442bbd7e927ab72df110cfa6bc32610bfa746cecd0c186",
      "tutorials/trace-a-menu-inquiry.md": "a4e65341380f72b5ac7ea8ae35cdfd6b56f67e6ef761922d6eccd8f5dfaf75f8",
      "tutorials/trace-an-existing-article.md": "5bc5010f8a6447ae465a08ba969f5acd306d1b9128b2f8019808ab4b0d509107"
    },
    "manifest_hash": "4ae831a40ab91c1c6826b571bb8337402b1f0a4cb006af4a484961aabd5c8c2d"
  },
  "impact": {
    "base": "Existing independent source/content/task review plus current final maintainer delta comparison",
    "changed_paths": [
      ".github/workflows/deploy-pages.yml",
      ".gitignore",
      "CONTEXT.md",
      "architecture.md",
      "developer/setup-and-project-map.md",
      "developer/testing-and-extension-points.md",
      "how-to/review-publication-and-domain-evidence.md",
      "maintenance/change-impact-and-docs-ownership.md",
      "operations/verification-and-troubleshooting.md",
      "reference/dependencies-and-configuration.md",
      "reference/generator-and-checker-cli.md",
      "manifest.json"
    ],
    "affected_pages": [
      "CONTEXT",
      "architecture",
      "developer/setup-and-project-map",
      "developer/testing-and-extension-points",
      "how-to/review-publication-and-domain-evidence",
      "maintenance/change-impact-and-docs-ownership",
      "operations/verification-and-troubleshooting",
      "reference/dependencies-and-configuration",
      "reference/generator-and-checker-cli"
    ],
    "affected_interfaces": [],
    "no_doc_impact": []
  },
  "checks": [
    {
      "command": "python3 tests/check-site.py",
      "environment": "/home/zack/Projects/culinary-revolutionary-redesign; existing python3, stdlib; normal assertions enabled, no install.",
      "effects": "Read exact current public HTML/XML and local target metadata only. Reviewed entire tests/check-site.py before execution. No write/network/server/form/analytics.",
      "exit": 0,
      "outcome": "PASS: 9 pages, 308 internal links, article metadata, 8 sitemap URLs and RSS.",
      "evidence": "Independent native BashHandle pid 1145658; completed exit/output inspected; duration 0.13266481994651258 seconds."
    },
    {
      "command": "/usr/bin/python3 -B /home/zack/Projects/fleet-index/_system/documentation/site/scripts/portal.py snapshot --registry /home/zack/Projects/fleet-index/_system/documentation/workspaces.json --project culinary",
      "environment": "Owning fleet-index documentation package /usr/bin/python3 -B; actual live registry and schemas. No kernel project import.",
      "effects": "Read-only source/page/nav/manifest/schema/link snapshot after reading portal implementation. No prepare/build/release/Git/index. Adapter enumerates other registered reader-route names for link validation, but no other project substantive source review was done.",
      "exit": 0,
      "outcome": "Snapshot valid: 38 declared source hashes, 27 reader-input hashes, manifest 03c2b22e211130f3e40ef9a9824efe647cbf92cdaf7c7475f4917e9297b84f8e. Final direct rehash equals native snapshot.",
      "evidence": "Latest completed BashHandle pid 1188903; initial snapshot and two subsequent renewed snapshots all exit 0. All source/doc/manifest deltas substantively reviewed, not merely rehashed."
    },
    {